{
  "schema_version": 1,
  "id": "example-1-1",
  "world": 1,
  "grid_width": 16,
  "grid_height": 15,
  "levels": [
    {
      "index": 0,
      "number": 1,
      "world": 1,
      "round": 1,
      "name": "1-1",
      "player": {
        "x": 3,
        "y": 6
      },
      "metadata": 2,
      "grid": [
        "2222222222222222",
        "1111111111111111",
        "1111111111111111",
        "1100000000000011",
        "1100000000000011",
        "1100000000000011",
        "1100500000e00011",
        "1111111111111011",
        "1100000000000011",
        "1100000000000011",
        "1100000000000011",
        "1100e00000005011",
        "1111111111111111",
        "1111111111111111",
        "1111111111111111"
      ],
      "objects": [
        {
          "type": 5,
          "positions": [
            [
              4,
              6
            ],
            [
              12,
              11
            ]
          ]
        },
        {
          "type": 14,
          "positions": [
            [
              10,
              6
            ],
            [
              4,
              11
            ]
          ]
        }
      ]
    }
  ]
}
